{
  "$schema": "http://json-schema.org/draft-06/schema",
  "type": "object",
  "properties": {
    "version": {
      "type": "number"
    },
    "success": {
      "type": "boolean"
    },
    "reason": {},
    "content": {
      "type": "object",
      "properties": {
        "href": {
          "type": "string"
        },
        "created_at": {
          "type": "string"
        },
        "updated_at": {
          "type": "string"
        },
        "update_type": {
          "type": "string"
        },
        "created_by": {
          "type": "object",
          "properties": {
            "href": {
              "type": "string"
            }
          }
        },
        "updated_by": {
          "type": "object",
          "properties": {
            "href": {
              "type": "string"
            }
          }
        },
        "ingress_services": {
          "type": "array"
        },
        "providers": {
          "type": "array",
          "items": {
            "type": "object",
            "properties": {
              "virtual_service": {
                "type": "object",
                "properties": {
                  "href": {
                    "type": "string"
                  }
                }
              }
            }
          }
        },
        "consumers": {
          "type": "array",
          "items": {
            "type": "object",
            "properties": {
              "ip_list": {
                "type": "object",
                "properties": {
                  "href": {
                    "type": "string"
                  }
                }
              }
            }
          }
        },
        "enabled": {
          "type": "boolean"
        },
        "resolve_labels_as": {
          "type": "object",
          "properties": {
            "providers": {
              "type": "array",
              "items": {
                "type": "string"
              }
            },
            "consumers": {
              "type": "array",
              "items": {
                "type": "string"
              }
            }
          }
        },
        "sec_connect": {
          "type": "boolean"
        },
        "stateless": {
          "type": "boolean"
        },
        "machine_auth": {
          "type": "boolean"
        },
        "unscoped_consumers": {
          "type": "boolean"
        },
        "network_type": {
          "type": "string"
        }
      }
    },
    "raw": {},
    "inputs": {
      "type": "object",
      "properties": {
        "illumio_rule_resolve_consumers_as": {
          "type": "array",
          "items": {
            "type": "string"
          }
        },
        "illumio_rule_consumers": {
          "type": "string"
        },
        "illumio_ruleset_href": {
          "type": "string"
        },
        "illumio_rule_resolve_providers_as": {
          "type": "array",
          "items": {
            "type": "string"
          }
        },
        "illumio_rule_providers": {
          "type": "string"
        }
      }
    },
    "metrics": {
      "type": "object",
      "properties": {
        "version": {
          "type": "string"
        },
        "package": {
          "type": "string"
        },
        "package_version": {
          "type": "string"
        },
        "host": {
          "type": "string"
        },
        "execution_time_ms": {
          "type": "integer"
        },
        "timestamp": {
          "type": "string"
        }
      }
    }
  }
}