{
  "version": 2.0,
  "success": true,
  "reason": null,
  "content": {
    "href": "/orgs/28/sec_policy/draft/rule_sets/12269/sec_rules/20997",
    "created_at": "2022-03-10T04:58:22.627Z",
    "updated_at": "2022-03-10T04:58:22.638Z",
    "update_type": "create",
    "created_by": {
      "href": "/users/520"
    },
    "updated_by": {
      "href": "/users/520"
    },
    "ingress_services": [],
    "providers": [
      {
        "virtual_service": {
          "href": "/orgs/28/sec_policy/draft/virtual_services/0447a982-ba9d-462d-bfc7-29bdac3627c3"
        }
      }
    ],
    "consumers": [
      {
        "ip_list": {
          "href": "/orgs/28/sec_policy/draft/ip_lists/105"
        }
      }
    ],
    "enabled": true,
    "resolve_labels_as": {
      "providers": [
        "virtual_services"
      ],
      "consumers": [
        "workloads"
      ]
    },
    "sec_connect": false,
    "stateless": false,
    "machine_auth": false,
    "consuming_security_principals": [],
    "unscoped_consumers": false,
    "network_type": "brn"
  },
  "raw": null,
  "inputs": {
    "illumio_rule_resolve_consumers_as": [
      "workloads"
    ],
    "illumio_rule_consumers": "/orgs/28/sec_policy/active/ip_lists/105",
    "illumio_ruleset_href": "/orgs/28/sec_policy/active/rule_sets/12269",
    "illumio_rule_resolve_providers_as": [
      "virtual_services"
    ],
    "illumio_rule_providers": "/orgs/28/sec_policy/active/virtual_services/0447a982-ba9d-462d-bfc7-29bdac3627c3"
  },
  "metrics": {
    "version": "1.0",
    "package": "fn-illumio",
    "package_version": "1.1.0",
    "host": "C02G82JEMD6R",
    "execution_time_ms": 467,
    "timestamp": "2022-03-09 23:58:22"
  }
}